{
  "id": "deepseek-chat-v3.1",
  "name": "DeepSeek V3.1",
  "provider": "openrouter",
  "litellm_model_name": "openrouter/deepseek/deepseek-chat-v3.1:free",
  "context_window": 128000,
  "max_output": 8192,
  "requires_api_key": "OPENROUTER_API_KEY",
  "description": "DeepSeek's hybrid reasoning model - 671B params, 37B active, FREE tier",
  "capabilities": [
    "reasoning",
    "chat",
    "code"
  ],
  "pricing": {
    "input_per_1m": "FREE",
    "output_per_1m": "FREE",
    "tier": "free"
  },
  "use_cases": [
    "Budget-conscious reasoning",
    "Experimental workflows",
    "High-volume applications"
  ],
  "release_date": "2025",
  "notes": "Supports reasoning_enabled boolean parameter",
  "parameters": {
    "reasoning_enabled": "boolean"
  },
  "performance": {
    "total_params": "671B",
    "active_params": "37B",
    "architecture": "MoE"
  },
  "enabled": false
}
