{
  "id": "claude-sonnet-4-5",
  "name": "Claude Sonnet 4.5",
  "provider": "anthropic",
  "litellm_model_name": "anthropic/claude-sonnet-4-5-20250929",
  "context_window": 200000,
  "max_output": 64000,
  "requires_api_key": "ANTHROPIC_API_KEY",
  "description": "Anthropic's most advanced Sonnet model - Hybrid reasoning with 30+ hour autonomy",
  "capabilities": [
    "chat",
    "reasoning",
    "code",
    "tool_calling",
    "vision"
  ],
  "pricing": {
    "input_per_1m": "$3.00",
    "output_per_1m": "$15.00",
    "tier": "standard"
  },
  "use_cases": [
    "Long-running autonomous tasks",
    "Complex multi-step workflows",
    "Advanced code generation",
    "Research and analysis",
    "Content creation at scale"
  ],
  "release_date": "2025-09-29",
  "notes": "Most intelligent and efficient Sonnet model - efficient for everyday use",
  "features": [
    "Hybrid reasoning mode",
    "30+ hour memory span",
    "Enhanced tool use",
    "Improved code generation"
  ],
  "enabled": true
}
