{
  "id": "gpt-5",
  "name": "GPT-5",
  "provider": "openai",
  "litellm_model_name": "openai/gpt-5-2025-08-07",
  "context_window": 400000,
  "max_output": 128000,
  "requires_api_key": "OPENAI_API_KEY",
  "description": "OpenAI's flagship GPT-5 model - Advanced reasoning, multimodal processing, tool calling",
  "capabilities": [
    "chat",
    "reasoning",
    "multimodal",
    "vision",
    "code",
    "tool_calling",
    "function_execution"
  ],
  "pricing": {
    "input_per_1m": "$1.25",
    "output_per_1m": "$10.00",
    "tier": "standard"
  },
  "use_cases": [
    "Complex reasoning tasks",
    "Multi-step problem solving",
    "Code generation and debugging",
    "Content creation and editing",
    "Research and analysis"
  ],
  "release_date": "2025-08-07",
  "notes": "Unprecedented capabilities in reasoning, coding, and agentic tasks",
  "enabled": true
}
