{
  "id": "gpt-5-mini",
  "name": "GPT-5 Mini",
  "provider": "openai",
  "litellm_model_name": "openai/gpt-5-mini-2025-08-07",
  "context_window": 400000,
  "max_output": 128000,
  "requires_api_key": "OPENAI_API_KEY",
  "description": "Cost-efficient GPT-5 variant for well-defined tasks",
  "capabilities": [
    "chat",
    "multimodal",
    "vision",
    "code",
    "tool_calling"
  ],
  "pricing": {
    "input_per_1m": "$0.25",
    "output_per_1m": "$2.00",
    "tier": "budget"
  },
  "use_cases": [
    "High-volume API calls",
    "Real-time chat applications",
    "Simple content generation",
    "Code completion",
    "Quick Q&A"
  ],
  "release_date": "2025-08-07",
  "notes": "80% cost reduction vs GPT-5 while maintaining strong performance",
  "enabled": true
}
