{
  "id": "gpt-5-pro",
  "name": "GPT-5 Pro",
  "provider": "openai",
  "litellm_model_name": "openai/gpt-5-pro-2025-10-06",
  "context_window": 400000,
  "max_output": 128000,
  "requires_api_key": "OPENAI_API_KEY",
  "description": "Scaled test-time compute for challenging reasoning tasks",
  "capabilities": [
    "reasoning",
    "code",
    "multimodal"
  ],
  "pricing": {
    "input_per_1m": "Premium tier",
    "output_per_1m": "Premium tier",
    "tier": "premium"
  },
  "use_cases": [
    "Mathematical proofs",
    "Complex code refactoring",
    "Research paper analysis",
    "Strategic planning",
    "Advanced debugging"
  ],
  "release_date": "2025-10-06",
  "notes": "Preferred in 67.8% of expert evaluations over GPT-5 Thinking",
  "performance": {
    "expert_preference": "67.8%",
    "vs_model": "GPT-5 Thinking"
  },
  "enabled": false
}
