{
  "id": "gpt-5-nano",
  "name": "GPT-5 Nano",
  "provider": "openai",
  "litellm_model_name": "openai/gpt-5-nano-2025-08-07",
  "context_window": 400000,
  "max_output": 128000,
  "requires_api_key": "OPENAI_API_KEY",
  "description": "Fastest, most cost-efficient GPT-5 for everyday tasks",
  "capabilities": [
    "chat",
    "reasoning"
  ],
  "pricing": {
    "input_per_1m": "$0.05",
    "output_per_1m": "$0.40",
    "tier": "budget"
  },
  "use_cases": [
    "High-throughput applications",
    "Simple classification",
    "Basic Q&A",
    "Text summarization",
    "Sentiment analysis"
  ],
  "release_date": "2025-08-07",
  "notes": "96% cost reduction vs GPT-5 - ideal for edge cases and batch processing",
  "enabled": true
}
